finding_id,issue_title,unit,program,year,cause_category,cause_detail,issue_detail,recommendation,outcomes_impact
FL-1886,การกำกับ ควบคุม การประกอบกิจการน้ำบาดาล,สำนักงานทรัพยากรน้ำแห่งชาติ,การบริหารจัดการทรัพยากรน้ำ,2566,ติดตาม/ประเมินผล/กำกับ,สาเหตุ: 1. ขาดการติดตามตรวจสอบผู้รับใบอนุญาตกรณีที่ยังไม่ได้ติดตั้งเครื่องวัดปริมาณน้ำ 2. ขาดแนวทางปฏิบัติที่ชัดเจนเกี่ยวกับการตรวจสอบผู้รับใบอนุญาตตามประกาศกระทรวงฯ และการดำเนินการกรณีใบอนุญาตสิ้นอายุ,"รายละเอียด: จากการสังเกตการณ์ 108 บ่อ พบปัญหา เช่น ไม่มีเครื่องวัดปริมาณน้ำ 36 บ่อ, มีการต่อท่อแยกโดยไม่ผ่านเครื่องวัด 9 บ่อ, ไม่มีลานคอนกรีต 40 บ่อ และใบอนุญาตสิ้นอายุแต่ยังไม่ต่อ 35 บ่อ (ซึ่ง 22 บ่อยังคงใช้งานอยู่)",ข้อเสนอแนะ: 1. ทบทวนและปรับปรุงแนวปฏิบัติในการออกใบอนุญาตประกอบกิจการน้ำบาดาลให้ครอบคลุมการติดตามตรวจสอบและการดำเนินการกรณีใบอนุญาตใกล้สิ้นอายุ 2. แจ้งเจ้าหน้าที่ให้ดำเนินการบังคับใช้กฎหมายอย่างเคร่งครัดกรณีพบผู้ฝ่าฝืน,ผลกระทบ: อาจส่งผลกระทบต่อการควบคุมการใช้น้ำบาดาลเพื่อให้เกิดความสมดุลและคุณภาพในระยะยาว และทำให้รายได้จากการจัดเก็บค่าใช้น้ำและค่าธรรมเนียมต่ำกว่าความเป็นจริง
FL-2235,การกำหนดนโยบายและหลักเกณฑ์ที่เกี่ยวข้องกับการจัดหาพลังงานไฟฟ้าในการบริหารจัดการเพื่อให้ได้มาซึ่งพลังงานไฟฟ้ายังไม่เกิดประสิทธิภาพสูงสุดต่อผู้ผลิตและผู้ใช้ไฟฟ้าในสถานการณ์ปัจจุบัน,1. สำนักงานนโยบายและแผนพลังงาน กระทรวงพลังงาน 2.สำนักงานคณะกรรมการกำกับกิจการพลังงาน 3.การไฟฟ้าฝ่ายผลิตแห่งประเทศไทย,ด้านการกำหนดโครงสร้างราคาพลังงานไฟฟ้า,2567,การเงิน/พัสดุ,1. แผนพัฒนากำลังการผลิตไฟฟ้า (PDP) กำหนดให้มีการใช้เชื้อเพลิงก๊าซธรรมชาติในสัดส่วนที่สูง. 2. รูปแบบของสัญญาการรับซื้อไฟฟ้าจากเอกชนทำให้ภาครัฐไม่สามารถสั่งผลิตไฟฟ้าจากโรงไฟฟ้าที่ต้นทุนต่ำที่สุดได้.,1. การผลิตไฟฟ้าของประเทศยังพึ่งพาก๊าซธรรมชาติในสัดส่วนที่สูง. 2. รูปแบบสัญญาการรับซื้อไฟฟ้าจากเอกชนทำให้ภาครัฐไม่สามารถเลือกสั่งเดินเครื่องโรงไฟฟ้าที่ต้นทุนต่ำที่สุดได้.,1. การจัดทำแผน PDP ควรคำนึงถึงความหลากหลายของชนิดเชื้อเพลิงและลดการพึ่งพาก๊าซธรรมชาติ. 2. การกำหนดนโยบายและหลักเกณฑ์ควรพิจารณาถึงความยืดหยุ่นของสัญญาและเงื่อนไขต่างๆ เพื่อให้ภาครัฐมีทางเลือกในการสั่งเดินเครื่องผลิตไฟฟ้า.,1. กฟผ. มีความเสี่ยงถูกปรับลดอันดับความน่าเชื่อถือ เนื่องจากต้องแบกรับภาระค่า Ft ค้างรับสะสมแทนผู้ใช้ไฟฟ้า. 2. ผู้ใช้ไฟฟ้ามีแนวโน้มที่จะแบกรับภาระค่าไฟฟ้าสูงขึ้นในอนาคต เพื่อชดเชยค่า Ft ค้างรับสะสม.
FL-2160,การขอเบิกค่าใช้จ่ายเพื่อบริการสาธารณสุขของหน่วยบริการไม่ถูกต้อง ส่งผลให้มีการเบิกจ่ายเงินโดยไม่ถูกต้อง,สำนักงานหลักประกันสุขภาพแห่งชาติ,ระบบหลักประกันสุขภาพ กองทุนหลักประกันสุขภาพแห่งชาติ,2564,ข้อมูล/บันทึก/เอกสาร,1. ความผิดพลาดของผู้ปฏิบัติงานบันทึกเวชระเบียน เช่น ไม่ชำนาญในการให้รหัสโรค หรือสับสนในการบันทึกข้อมูลเพื่อเบิกค่าบริการหลายสิทธิ. 2. เงื่อนไขการตรวจสอบเอกสารหลักฐานการเบิกจ่ายผ่านระบบ e-Claim ยังไม่เพียงพอ.,สปสช. สุ่มตรวจสอบเวชระเบียนที่หน่วยบริการบันทึกข้อมูลไม่ถูกต้องถึงร้อยละ 47.23 และพบธุรกรรมที่ไม่ผ่านเงื่อนไขการตรวจสอบก่อนเบิกจ่ายจำนวนมาก.,1. เสริมสร้างความรู้ความเข้าใจให้แก่บุคลากรที่เกี่ยวข้องกับการบันทึกเวชระเบียน. 2. ปรับปรุงหลักเกณฑ์หรือเงื่อนไขของการตรวจสอบก่อนการเบิกจ่าย (Pre-audit) ให้ครอบคลุมมากขึ้น.,1. สปสช. อาจต้องจ่ายค่าบริการเกินจริง. 2. หน่วยบริการอาจถูกเรียกเงินคืนหรือเบิกจ่ายชดเชยเงินเพิ่ม ทำให้เสียประโยชน์และส่ง ต่อสภาพคล่องทางการเงิน.
FL-2173,การขอเบิกค่าใช้จ่ายเพื่อบริการสาธารณสุขของหน่วยบริการไม่ถูกต้อง ส่งผลให้มีการเบิกจ่ายเงินโดยไม่ถูกต้อง,สำนักงานหลักประกันสุขภาพแห่งชาติ,ระบบหลักประกันสุขภาพ กองทุนหลักประกันสุขภาพแห่งชาติ,2564,ข้อมูล/บันทึก/เอกสาร,1. ความผิดพลาดของผู้ปฏิบัติงานบันทึกเวชระเบียน เช่น ไม่ชำนาญในการให้รหัสโรค หรือสับสนในการบันทึกข้อมูลเพื่อเบิกค่าบริการหลายสิทธิ. 2. เงื่อนไขการตรวจสอบเอกสารหลักฐานการเบิกจ่ายผ่านระบบ e-Claim ยังไม่เพียงพอ.,สปสช. สุ่มตรวจสอบเวชระเบียนที่หน่วยบริการบันทึกข้อมูลไม่ถูกต้องถึงร้อยละ 47.23 และพบธุรกรรมที่ไม่ผ่านเงื่อนไขการตรวจสอบก่อนเบิกจ่ายจำนวนมาก.,1. เสริมสร้างความรู้ความเข้าใจให้แก่บุคลากรที่เกี่ยวข้องกับการบันทึกเวชระเบียน. 2. ปรับปรุงหลักเกณฑ์หรือเงื่อนไขของการตรวจสอบก่อนการเบิกจ่าย (Pre-audit) ให้ครอบคลุมมากขึ้น.,1. สปสช. อาจต้องจ่ายค่าบริการเกินจริง. 2. หน่วยบริการอาจถูกเรียกเงินคืนหรือเบิกจ่ายชดเชยเงินเพิ่ม ทำให้เสียประโยชน์และส่ง ต่อสภาพคล่องทางการเงิน.
FL-2195,การขอเบิกค่าใช้จ่ายเพื่อบริการสาธารณสุขของหน่วยบริการไม่ถูกต้อง ส่งผลให้มีการเบิกจ่ายเงินโดยไม่ถูกต้อง,สำนักงานหลักประกันสุขภาพแห่งชาติ,ระบบหลักประกันสุขภาพ กองทุนหลักประกันสุขภาพแห่งชาติ,2564,ข้อมูล/บันทึก/เอกสาร,1. ความผิดพลาดของผู้ปฏิบัติงานบันทึกเวชระเบียน เช่น ไม่ชำนาญในการให้รหัสโรค หรือสับสนในการบันทึกข้อมูลเพื่อเบิกค่าบริการหลายสิทธิ. 2. เงื่อนไขการตรวจสอบเอกสารหลักฐานการเบิกจ่ายผ่านระบบ e-Claim ยังไม่เพียงพอ.,สปสช. สุ่มตรวจสอบเวชระเบียนที่หน่วยบริการบันทึกข้อมูลไม่ถูกต้องถึงร้อยละ 47.23 และพบธุรกรรมที่ไม่ผ่านเงื่อนไขการตรวจสอบก่อนเบิกจ่ายจำนวนมาก.,1. เสริมสร้างความรู้ความเข้าใจให้แก่บุคลากรที่เกี่ยวข้องกับการบันทึกเวชระเบียน. 2. ปรับปรุงหลักเกณฑ์หรือเงื่อนไขของการตรวจสอบก่อนการเบิกจ่าย (Pre-audit) ให้ครอบคลุมมากขึ้น.,1. สปสช. อาจต้องจ่ายค่าบริการเกินจริง. 2. หน่วยบริการอาจถูกเรียกเงินคืนหรือเบิกจ่ายชดเชยเงินเพิ่ม ทำให้เสียประโยชน์และส่ง ต่อสภาพคล่องทางการเงิน.
FL-1852,การขับเคลื่อนโครงการขนาดใหญ่และโครงการสำคัญเพื่อแก้ไขปัญหาทรัพยากรน้ำในพื้นที่ Area based,สำนักงานทรัพยากรน้ำแห่งชาติ,การบริหารจัดการทรัพยากรน้ำ,2566,,,รายละเอียด: ณ วันที่ 30 ก.ย. 65 สทนช. มีแผนดำเนินการศึกษาแผนหลักในพื้นที่ Area Based เพียง 25 จาก 66 พื้นที่ โดยมีโครงการที่ได้รับงบประมาณก่อสร้างแล้ว 241 โครงการ และอยู่ระหว่างขับเคลื่อน 505 โครงการ จากทั้งหมด 746 โครงการ แต่การขับเคลื่อนยังไม่เป็นไปตามแผนเนื่องจากปัญหาการขอใช้พื้นที่ ผลกระทบสิ่งแวดล้อม และการมีส่วนร่วมของประชาชน,,ผลกระทบ: (ไม่ได้ระบุ) สาเหตุ: (ไม่ได้ระบุ) ข้อเสนอแนะ: กำหนดให้มีแนวทางการประเมินหรือทบทวนพื้นที่ Area Based ทั้ง 66 พื้นที่ ให้สอดคล้องกับสภาพปัญหาปัจจุบัน เพื่อนำข้อมูลมาปรับปรุงแผนการขับเคลื่อนโครงการขนาดใหญ่และโครงการสำคัญร่วมกับข้อมูลผลการศึกษาอื่นๆ ให้ตอบสนองต่อความต้องการของประชาชน
FL-1903,การขับเคลื่อนโดยศูนย์ประสานงานระดับประถมศึกษาและระดับมัธยมศึกษาแต่ละภูมิภาคของโรงเรียนคุณภาพประจำตำบลยังไม่เป็นไปตามแนวทางที่กำหนด,สำนักงานคณะกรรมการการศึกษาขั้นพื้นฐาน,โครงการโรงเรียนคุณภาพประจำตำบล,2566,การประสานงาน/บูรณาการ,) ความไม่ต่อเนื่องในเชิงนโยบายเกี่ยวกับการขับเคลื่อนภารกิจศูนย์ประสานงานฯ ขาดความต่อเนื่องและชัดเจนในการขับเคลื่อนการบริหารจัดการของศูนย์ประสานงานฯ,) ศูนย์ประสานงานฯ ระดับประถมศึกษาและมัธยมศึกษาที่สุ่มตรวจสอบยังไม่ได้ดำเนินการขับเคลื่อนกิจกรรมให้เป็นไปตามบทบาทหน้าที่ที่กำหนด,) กำชับให้สำนักงานเขตพื้นที่การศึกษาร่วมกับศูนย์ประสานงานฯ วางแผนการดำเนินงานและขับเคลื่อนกิจกรรม,) การขับเคลื่อนภารกิจศูนย์ประสานงานฯ ขาดความต่อเนื่องและชัดเจน
FL-1945,การขับเคลื่อนประเด็นแผนแม่บท เป้าหมายภาครัฐมีการดำเนินการที่มีประสิทธิภาพ ด้วยการนำนวัตกรรม เทคโนโลยีมาประยุกต์ใช้ ยังมีประเด็นความเสี่ยงในการดำเนินงานที่จะส่งผลต่อการบรรลุค่าเป้าหมายที่กำหนด,ไม่ชัดเจน,แผนแม่บทภายใต้ยุทธศาสตร์ชาติประเด็นการบริการประชาชนและประสิทธิภาพภาครัฐ,2567,การวางแผน/ตัวชี้วัด,) การขับเคลื่อนเพื่อบรรลุเป้าหมายยุทธศาสตร์ชาติยังไม่ได้ระบุวิธีปฏิบัติที่จะนำไปสู่การดำเนินการตามบทบาทหน้าที่ของหน่วยงานเจ้าภาพแต่ละระดับอย่างชัดเจน,) 1. ความสำเร็จของตัวชี้วัดเป้าหมายภาครัฐมีการดำเนินการที่มีประสิทธิภาพด้วยการนำนวัตกรรม เทคโนโลยีมาประยุกต์ใช้ อาจไม่สามารถสะท้อนการขับเคลื่อนประเด็นแผนแม่บทได้ ( ) 2. การจัดทำโครงการภายใต้แผนแม่บทการบริการประชาชนและประสิทธิภาพภาครัฐ ยังไม่สอดคล้องตามหลักการความสัมพันธ์เชิงเหตุและผล (Causal Relationship : XYZ),) 1. หารือร่วมกับหน่วยงานเจ้าภาพทุกระดับเพื่อทำความเข้าใจและกำหนดแผนการดำเนินงานร่วมกันเกี่ยวกับทิศทางการขับเคลื่อนแผนแม่บท ( ) 2. รวบรวมปัญหา อุปสรรค หรือข้อจำกัดที่เกิดจากการดำเนินการขับเคลื่อนเป้าหมายระดับประเด็นแผนแม่บท,) การขับเคลื่อนการพัฒนาตามค่าเป้าหมายระดับประเด็นแผนแม่บท (Y2) อาจไม่ได้สะท้อนมาจากผลการขับเคลื่อนเป้าหมายของแผนแม่บทย่อย (Y1) ตามหลักการความสัมพันธ์เชิงเหตุและผล
FL-1943,การขับเคลื่อนแผนแม่บทประเด็นการบริการประชาชนและประสิทธิภาพภาครัฐ ยังไม่สอดคล้องตามหลักการความสัมพันธ์เชิงเหตุและผล (XYZ) และมีความเสี่ยงที่จะส่งผลต่อความสำเร็จของการบรรลุเป้าหมายระดับประเด็นแผนแม่บทฯ (Y2),ไม่ชัดเจน,แผนแม่บทภายใต้ยุทธศาสตร์ชาติประเด็นการบริการประชาชนและประสิทธิภาพภาครัฐ สำนักงานคณะกรรมการพัฒนาระบบราชการ,2567,ข้อมูล/บันทึก/เอกสาร,) 1. หน่วยงานเจ้าภาพขับเคลื่อนเป้าหมายระดับประเด็นแผนแม่บทฯ (จ.2) ยังไม่ได้ดำเนินการตามบทบาทหน้าที่หลักในการประสานและบูรณาการการทำงานร่วมกัน ( ) 2. หน่วยงานเจ้าภาพขับเคลื่อนเป้าหมายระดับประเด็นแผนแม่บทฯ (จ.2) ไม่ได้ติดตามตรวจสอบการดำเนินงานของหน่วยงานที่ร่วมขับเคลื่อน ( ) 3. การประเมินผลตามตัวชี้วัดยังไม่สามารถสอบยันข้อมูลงานบริการที่สะท้อนความสำเร็จของการดำเนินงานโครงการ,) 1. การจัดทำโครงการภายใต้แผนแม่บทฯ ยังไม่สอดคล้องตามหลักการความสัมพันธ์เชิงเหตุและผล (XYZ) ( ) 2. ความสำเร็จของประเด็นแผนแม่บทฯ เป้าหมายบริการของรัฐมีประสิทธิภาพและมีคุณภาพเป็นที่ยอมรับของผู้ใช้บริการ ไม่สามารถสะท้อนการขับเคลื่อนแผนแม่บทย่อยได้ ( ) 3. ความสำเร็จของตัวชี้วัดเป้าหมายภาครัฐมีการดำเนินการที่มีประสิทธิภาพด้วยการนำนวัตกรรม เทคโนโลยีมาประยุกต์ใช้ อาจไม่สามารถสะท้อนการขับเคลื่อนประเด็นแผนแม่บทฯ ได้,) 1. หารือร่วมกับหน่วยงานเจ้าภาพทุกระดับเพื่อทำความเข้าใจและกำหนดแผนการดำเนินงานร่วมกันเกี่ยวกับทิศทางการขับเคลื่อนแผนแม่บทฯ ( ) 2. รวบรวมปัญหา อุปสรรค หรือข้อจำกัดที่เกิดจากการดำเนินการขับเคลื่อนแผนแม่บทฯ ( ) 3. ทบทวนวิธีการประเมินตัวชี้วัดระดับความพึงพอใจในคุณภาพการให้บริการของภาครัฐ,) การบรรลุค่าเป้าหมายระดับประเด็นแผนแม่บทฯ ไม่ได้สะท้อนมาจากการดำเนินงานภายใต้แผนแม่บทย่อย
