finding_id,issue_title,unit,program,year,cause_category,cause_detail,issue_detail,recommendation,outcomes_impact
FL-2128,กระบวนการขอรับใบอนุญาต การออกใบอนุญาต และการออกใบแทนใบอนุญาตสำหรับวัสดุกัมมันตรังสีบางส่วนยังไม่เป็นไปตามระยะเวลาที่กำหนด และฐานข้อมูลสำหรับการดำเนินการออกใบอนุญาตยังไม่ถูกต้อง และไม่เป็นปัจจุบัน,สำนักงานปรมาณูเพื่อสันติ,การบริหารจัดการและควบคุมวัสดุกัมมันตรังสี สำนักงานปรมาณูเพื่อสันติ กระทรวงการอุดมศึกษา วิทยาศาสตร์ วิจัยและนวัตกรรม,2567,ข้อมูล/บันทึก/เอกสาร,สาเหตุ: 1. ขาดแนวทางและมาตรการที่ชัดเจนในการจัดการกรณีที่ผู้ขอใบอนุญาตส่งเอกสารไม่ครบถ้วน 2. ขาดกระบวนการติดตามกำกับดูแลให้สถานประกอบการต่ออายุใบอนุญาตตามกำหนด 3. สถานประกอบการบางแห่งไม่ให้ความสำคัญและขาดความเข้าใจในกระบวนการขอรับใบอนุญาต 4. ไม่มีการตรวจสอบหรือสอบยันฐานข้อมูลในระบบ e-License กับข้อมูลจริง 5. ขาดการเชื่อมโยงข้อมูลระหว่างหน่วยงานที่เกี่ยวข้องของ ปส. และระบบ e-License มีประสิทธิภาพลดลง 6. ขาดคู่มือการใช้งานระบบ e-License ที่ชัดเจน เช่น การกำหนดรหัสหรือเลขที่ใบอนุญาต,"รายละเอียด: 1. การออกใบอนุญาตล่าช้า: ปส. ยังไม่สามารถออกใบอนุญาตให้แก่หน่วยงาน/สถานประกอบการได้ 26 ฉบับ ตั้งแต่ปี 2565 และการออกใบอนุญาตตั้งแต่ขั้นตอนยื่นคำขอจนถึงออกใบอนุญาตไม่เป็นไปตามกรอบเวลาที่กำหนด 100 ฉบับ นอกจากนี้ ยังมีสถานประกอบการ 52 แห่ง ที่ดำเนินการต่ออายุใบอนุญาตหลังจากใบอนุญาตหมดอายุแล้ว 2 ฐานข้อมูลไม่ถูกต้อง/ไม่เป็นปัจจุบัน: ฐานข้อมูลในระบบ e-License มีปัญหาหลายประการ เช่น ปรากฏข้อมูลสถานประกอบการที่ขาดการต่ออายุใบอนุญาต (161 แห่ง), สถานะการใช้งานวัสดุไม่ตรงตามจริง, บางหน่วยงานไม่พบในฐานข้อมูล, และรูปแบบข้อมูลเลขที่ใบอนุญาตไม่เป็นรูปแบบเดียวกัน","ข้อเสนอแนะ: 1. ทบทวนและกำหนดแนวทาง, กรอบเวลา, และมาตรการที่ชัดเจนในกระบวนการออกใบอนุญาต 2. ประชาสัมพันธ์และซักซ้อมความเข้าใจแก่สถานประกอบการให้เห็นความสำคัญของการดำเนินการขอรับใบอนุญาต 3. กำหนดแนวทางและกระบวนการติดตามกำกับดูแลสถานประกอบการในการขอและต่ออายุใบอนุญาตให้ชัดเจน 4. ดำเนินการสำรวจและสอบยันฐานข้อมูลในระบบ e-License กับข้อมูลจริง พร้อมทั้งปรับปรุงให้ถูกต้องและเป็นปัจจุบัน 5. พิจารณากำหนดคู่มือการใช้งานระบบ e-License ให้ชัดเจน 6. เร่งรัดโครงการพัฒนาด้านดิจิทัลเพื่อการกำกับดูแลฯ ให้สามารถใช้งานได้โดยเร็ว",ผลกระทบ: 1. การควบคุมกำกับดูแลมีความเสี่ยงที่จะเกิดความไม่ปลอดภัย และส่งผลต่อความเชื่อมั่นของประชาชนในกระบวนการออกใบอนุญาต 2. เกิดความเสี่ยงที่วัสดุกัมมันตรังสีอาจสูญหาย โดยเฉพาะประเภทที่ 1 และ 2 ซึ่งมีระดับความอันตรายสูง 3. ปส. ขาดข้อมูลที่สำคัญและถูกต้องสำหรับการวางแผนการตรวจสอบและติดตามข้อมูลวัสดุกัมมันตรังสี
FL-1977,กลุ่มแปลงใหญ่ข้าวส่วนใหญ่มีการใช้ประโยชน์สิ่งที่ได้รับการสนับสนุนจากโครงการฯ แต่ไม่ครบทุกกิจกรรม/ทุกรายการ,กรมส่งเสริมการเกษตร,โครงการยกระดับแปลงใหญ่ด้วยเกษตรสมัยใหม่และเชื่อมโยงตลาด,2565,บุคลากร/สมรรถนะ,"สาเหตุ: 1. สภาพภูมิอากาศ: การใช้ประโยชน์อุปกรณ์บางอย่างขึ้นอยู่กับสภาพอากาศ เช่น เครื่องหยอดข้าวและเครื่องอัดฟาง 2 โครงการเร่งด่วน: ระยะเวลาเสนอโครงการที่จำกัด ทำให้กลุ่มอาจไม่ได้พิจารณาอย่างรอบด้าน และขาดความรู้ความเข้าใจในการพัฒนาด้านต่าง ๆ 3 ขาดการดำเนินกิจกรรมร่วมกัน: กลุ่มรวมตัวเพื่อขอรับการสนับสนุน แต่ขาดการวางแผนการผลิตและรวบรวมผลผลิตร่วมกัน 4 การพิจารณาอนุมัติไม่รัดกุม: คณะกรรมการฯ ระดับจังหวัดอาจพิจารณาอนุมัติโดยไม่ได้คำนึงถึงความพร้อมของกลุ่มในด้านอื่น ๆ เช่น บุคลากร, ระบบสาธารณูปโภค 5 ขาดการกำกับติดตาม: หน่วยงานเจ้าของสินค้าแปลงใหญ่ในพื้นที่ขาดการกำกับและติดตามผลหลังสิ้นสุดโครงการ",รายละเอียด: จากการสุ่มตรวจสอบกลุ่มแปลงใหญ่ข้าว 80 แปลง พบว่า: - ใช้ประโยชน์แต่ไม่ครบ: 57 แปลง (71.25%) มีการใช้ประโยชน์สิ่งที่ได้รับแต่ไม่ครบทุกรายการ โดยมี 159 รายการที่ไม่ได้ใช้ประโยชน์ (มูลค่า 20.98 ล้านบาท) และ 95 รายการที่ใช้ประโยชน์ในระดับน้อย (มูลค่า 20.28 ล้านบาท) - ไม่ใช้ประโยชน์เลย: 2 แปลง (2.50%) ไม่มีการใช้ประโยชน์สิ่งที่ได้รับเลย (16 รายการ มูลค่า 5.93 ล้านบาท),"ข้อเสนอแนะ: 1. สำหรับโครงการในอนาคต: ควรกำหนดกรอบเวลาเสนอโครงการที่เหมาะสม, มีหลักเกณฑ์การพิจารณาที่ชัดเจน, และเพิ่มการพิจารณาความพร้อมของกลุ่มในด้านต่าง ๆ 2 การกำกับดูแล: กำหนดแนวทางและผู้รับผิดชอบในการกำกับดูแลและติดตามการดำเนินงานของกลุ่มแปลงใหญ่หลังสิ้นสุดโครงการให้ชัดเจน",ผลกระทบ: 1. สิ่งที่ไม่ได้ใช้ประโยชน์ (มูลค่า 26.91 ล้านบาท) ทำให้ระยะเวลารับประกันสูญไปโดยเปล่าประโยชน์ และกลุ่มต้องรับภาระค่าซ่อมแซมเองในอนาคต 2. สมาชิกเสียโอกาสในการนำเทคโนโลยีเกษตรสมัยใหม่มาใช้เพื่อเพิ่มประสิทธิภาพและลดต้นทุน 3. การใช้งบประมาณเงินกู้ในโครงการที่ไม่เร่งด่วนทำให้เกิดค่าเสียโอกาสและต้นทุนดอกเบี้ยโดยไม่จำเป็น
FL-1981,กลุ่มแปลงใหญ่ข้าวส่วนใหญ่มีการใช้ประโยชน์สิ่งที่ได้รับการสนับสนุนจากโครงการฯ แต่ไม่ครบทุกกิจกรรม/ทุกรายการ,กรมส่งเสริมการเกษตร,โครงการยกระดับแปลงใหญ่ด้วยเกษตรสมัยใหม่และเชื่อมโยงตลาด,2565,,,"รายละเอียด: จากการสุ่มตรวจสอบกลุ่มแปลงใหญ่ข้าว 80 แปลง พบว่า 57 แปลง (71.25%) มีการใช้ประโยชน์สิ่งที่ได้รับแต่ไม่ครบทุกรายการ โดยมี 159 รายการที่ไม่ได้ใช้ประโยชน์ (มูลค่า 20.98 ล้านบาท) และอีก 2 แปลง (2.50%) ไม่มีการใช้ประโยชน์สิ่งที่ได้รับเลย (มูลค่า 5.93 ล้านบาท) ผลกระทบ: 1. สิ่งที่ไม่ได้ใช้ประโยชน์ (มูลค่ารวม 26.91 ล้านบาท) ทำให้ระยะเวลารับประกันสูญไปโดยเปล่าประโยชน์ และกลุ่มต้องรับภาระค่าซ่อมแซมเองในอนาคต 2. สมาชิกกลุ่มเสียโอกาสในการนำเทคโนโลยีเกษตรสมัยใหม่มาใช้เพื่อเพิ่มประสิทธิภาพและลดต้นทุนการผลิต 3. การใช้งบประมาณเงินกู้ในโครงการที่ไม่เร่งด่วนทำให้เกิดค่าเสียโอกาสและมีภาระต้นทุนดอกเบี้ยโดยไม่จำเป็น สาเหตุ: 1. สภาพภูมิอากาศเป็นอุปสรรคต่อการใช้อุปกรณ์บางชนิด 2. ระยะเวลาเสนอโครงการที่จำกัด ทำให้กลุ่มอาจไม่ได้พิจารณาอย่างรอบด้าน 3. กลุ่มขาดการวางแผนการผลิตและรวบรวมผลผลิตร่วมกัน 4. คณะกรรมการฯ ระดับจังหวัดอาจอนุมัติโครงการโดยไม่ได้คำนึงถึงความพร้อมของกลุ่มในด้านอื่น ๆ 5. ขาดการกำกับและติดตามผลหลังสิ้นสุดโครงการ ข้อเสนอแนะ: 1. สำหรับโครงการในอนาคต: ควรกำหนดกรอบเวลาเสนอโครงการที่เหมาะสม, มีหลักเกณฑ์การพิจารณาที่ชัดเจน, และเพิ่มการพิจารณาความพร้อมของกลุ่มในด้านต่าง ๆ 2. การกำกับดูแล: กำหนดแนวทางและผู้รับผิดชอบในการกำกับดูแลและติดตามการดำเนินงานของกลุ่มแปลงใหญ่หลังสิ้นสุดโครงการให้ชัดเจน",,
FL-1987,กลุ่มแปลงใหญ่ยางพาราส่วนใหญ่มีการใช้ประโยชน์สิ่งที่ได้รับการสนับสนุนจากโครงการฯ แต่ไม่ครบทุกกิจกรรม/ทุกรายการ,กรมส่งเสริมการเกษตร,โครงการยกระดับแปลงใหญ่ด้วยเกษตรสมัยใหม่และเชื่อมโยงตลาด,2565,,,"รายละเอียด: จากการตรวจสอบ 15 แปลง พบว่า 14 แปลง (93.33%) มีการใช้ประโยชน์สิ่งที่ได้รับแต่ไม่ครบทุกรายการ โดยมี 66 รายการที่ไม่ได้ใช้ประโยชน์ (มูลค่า 22.02 ล้านบาท) และ 36 รายการที่ใช้ประโยชน์ในระดับน้อย (มูลค่า 9.53 ล้านบาท) ผลกระทบ: 1. สิ่งที่ไม่ได้ใช้ประโยชน์ (มูลค่า 22.02 ล้านบาท) ทำให้ระยะเวลารับประกันสูญไป และกลุ่มต้องรับภาระค่าซ่อมแซมเอง 2. สมาชิกเสียโอกาสในการนำเทคโนโลยีมาใช้เพื่อเพิ่มประสิทธิภาพและลดต้นทุน 3. การใช้งบประมาณเงินกู้ไม่เกิดความคุ้มค่า สาเหตุ: 1. สภาพภูมิอากาศ (ฝนตก) เป็นอุปสรรค 2. ระยะเวลาเสนอโครงการจำกัด ทำให้กลุ่มไม่ได้พิจารณาอย่างรอบด้าน 3. ขาดการดำเนินกิจกรรมร่วมกันในกลุ่ม 4. การพิจารณาอนุมัติไม่ได้คำนึงถึงความพร้อมของกลุ่มในด้านอื่น 5. ขาดการกำกับติดตามหลังสิ้นสุดโครงการ ข้อเสนอแนะ: 1. สำหรับโครงการในอนาคต: ควรกำหนดกรอบเวลาเสนอโครงการที่เหมาะสม, มีหลักเกณฑ์การพิจารณาที่ชัดเจน, และเพิ่มการพิจารณาความพร้อมของกลุ่มในด้านต่าง ๆ 2. การกำกับดูแล: กำหนดแนวทางและผู้รับผิดชอบในการกำกับดูแลและติดตามการดำเนินงานของกลุ่มแปลงใหญ่หลังสิ้นสุดโครงการให้ชัดเจน",,
FL-1991,กลุ่มแปลงใหญ่ส่วนใหญ่มีการใช้ประโยชน์สิ่งที่ได้รับการสนับสนุนจากโครงการฯ แต่ไม่ครบทุกกิจกรรม/ทุกรายการ,กรมส่งเสริมการเกษตร,โครงการยกระดับแปลงใหญ่ด้วยเกษตรสมัยใหม่และเชื่อมโยงตลาด,2565,,,"รายละเอียด: จากการสุ่มตรวจสอบ 265 แปลง พบว่า 205 แปลง (77.36%) มีการใช้ประโยชน์แต่ไม่ครบทุกรายการ และอีก 13 แปลง (4.91%) ไม่มีการใช้ประโยชน์เลย ซึ่งคิดเป็นมูลค่าสิ่งที่ไม่ได้ใช้ประโยชน์รวม 112.98 ล้านบาท ผลกระทบ: 1. สิ่งที่ไม่ได้ใช้ประโยชน์ทำให้ระยะเวลารับประกันสูญไป และกลุ่มต้องรับภาระค่าซ่อมแซมเอง 2. สมาชิกเสียโอกาสในการนำเทคโนโลยีมาใช้เพื่อเพิ่มประสิทธิภาพและลดต้นทุน 3. การใช้งบประมาณเงินกู้ไม่เกิดความคุ้มค่า สาเหตุ: 1. สภาพภูมิอากาศเป็นอุปสรรค 2. ระยะเวลาเสนอโครงการจำกัด ทำให้กลุ่มไม่ได้พิจารณาอย่างรอบด้าน 3. ขาดการดำเนินกิจกรรมร่วมกันในกลุ่ม 4. การพิจารณาอนุมัติไม่ได้คำนึงถึงความพร้อมของกลุ่มในด้านอื่น 5. ขาดการกำกับติดตามหลังสิ้นสุดโครงการ ข้อเสนอแนะ: 1. สำหรับโครงการในอนาคต: ควรกำหนดกรอบเวลาเสนอโครงการที่เหมาะสม, มีหลักเกณฑ์การพิจารณาที่ชัดเจน, และเพิ่มการพิจารณาความพร้อมของกลุ่มในด้านต่าง ๆ 2. การกำกับดูแล: กำหนดแนวทางและผู้รับผิดชอบในการกำกับดูแลและติดตามการดำเนินงานของกลุ่มแปลงใหญ่หลังสิ้นสุดโครงการให้ชัดเจน",,
FL-1970,การกำหนดตัวชี้วัดตามโครงการสำคัญด้านการเพิ่มประสิทธิภาพการผลิตข้าว บางส่วนอาจยังไม่เชื่อมโยงกับแผนแม่บทฯ,กรมการข้าว,การเพิ่มประสิทธิภาพกระบวนการผลิตข้าว,2564,,,รายละเอียด: การกำหนดเป้าหมายตัวชี้วัดของโครงการบางส่วนขาดความเชื่อมโยงหรือไม่สอดคล้องโดยตรงกับข้อมูลที่ใช้ในการคำนวณตัวชี้วัดตามแผนแม่บทภายใต้ยุทธศาสตร์ชาติ ประเด็นเกษตร: 1. ด้านปริมาณผลผลิต: บางโครงการกำหนดตัวชี้วัดเป็นจำนวนพื้นที่ (ไร่) หรือจำนวนเกษตรกร ซึ่งไม่สะท้อนปริมาณผลผลิตข้าวที่ผลิตได้โดยตรง 2 ด้านราคาผลผลิต: บางโครงการไม่มีการกำหนดเป้าหมายตัวชี้วัดที่เชื่อมโยงกับราคาผลผลิตข้าวโดยตรง ทำให้ไม่ทราบว่าเกษตรกรสามารถจำหน่ายข้าวได้ในราคาที่สูงขึ้นหรือไม่,ข้อเสนอแนะ: ปรับปรุงตัวชี้วัดผลการดำเนินงานโครงการให้มีตัวชี้วัดร่วมกันที่มีความชัดเจน และเชื่อมโยงกับตัวชี้วัดตามแผนแม่บทฯ พร้อมทั้งปรับปรุงระบบการติดตามและรายงานผลให้สอดคล้องกัน,ผลกระทบ: อาจไม่สามารถนำตัวชี้วัดตามโครงการไปใช้ในการประเมินผลการบรรลุค่าเป้าหมายตัวชี้วัดตามแผนแม่บทภายใต้ยุทธศาสตร์ชาติ ประเด็นการเกษตร ในภาพรวมได้อย่างแท้จริง
